B1: | Home | Forum | Results | Schedule | US Open | Members | | Archives | Photos | Contact | Links | Rules |

A1: Spring Lake - April 9, 2001 Dan Bass with his big fish of 6.42 which anchored his winning limit Eric "E-DOG" Howard in the money again with some solid Spring Lake fish Chris Zaldain with two big dogs including a 6.28lb toad Rob Belloni with big fish of the tourney at 8.15 taken on the MS Slammer MORE PHOTOS ->

A1: Place | B1: ANGLER | C1: BF | D1: # FISH | E1: TOTAL WEIGHT
A2: 1 | B2: Dan Bass | C2: 6.42 | D2: 5 | E2: =B1 -> 15.22
A3: 2 | B3: Eric Howard | C3: 5.4 | D3: 4 | E3: =B2 -> 13.90
A4: 3 | B4: Chris Zaldain | C4: 6.28 | D4: 3 | E4: =B3 -> 12.87
A5: 4 | B5: Rob Belloni | C5: 8.15 | D5: 3 | E5: =B4 -> 12.64
A6: 5 | B6: Jeff Smith | D6: 5 | E6: =B5 -> 8.54
A7: 6 | B7: Todd Iwamoto | D7: 4 | E7: =B6 -> 7.92
A8: 7 | B8: Rich Caro | C8: 3.78 | D8: 2 | E8: =B7 -> 6.39
A9: 8 | B9: Chris Youlden | D9: 3 | E9: =B8 -> 5.9
A10: 9 | B10: Paul Mibach | D10: 3 | E10: =B9 -> 5.13
A11: 10 | B11: Robert Linden | D11: 2 | E11: =B10 -> 3.97
A12: 11 | B12: Dave Ryle | D12: 2 | E12: =B11 -> 3.02
A13: 12 | B13: Gene Gonzales | D13: 1 | E13: =B12 -> 2.63
A14: 13 | B14: Clint Ryle | E14: =B13 -> -
A15: 14 | B15: Jeff Andress | E15: =B14 -> -
A16: 15 | B16: John Lake | E16: =B15 -> -
A17: 16 | B17: Nicolo Raffo | E17: =B16 -> -
A18: 17 | B18: Sal Plasencia | E18: =B17 -> -
A19: 18 | B19: Steve Williams | E19: =B18 -> -